{"candidate_id":"human_gold_candidate_v0_1","chapter_candidates":[{"candidate_chapter_id":"rchreview_17eded64ac1e5b7677305b76","course_id":"CTRL202","final_chapter_id":null,"final_chapter_path":null,"final_end_slide":null,"final_start_slide":null,"human_review":{"review_note":null,"reviewed_by":null,"selected":null,"status":"pending"},"source_chapter_label":"2.0 数学模型概述","suggested_end_slide_not_gold":5,"suggested_start_slide_not_gold":1},{"candidate_chapter_id":"rchreview_c8850b12e21f63a87c300869","course_id":"CTRL202","final_chapter_id":null,"final_chapter_path":null,"final_end_slide":null,"final_start_slide":null,"human_review":{"review_note":null,"reviewed_by":null,"selected":null,"status":"pending"},"source_chapter_label":"2.1 控制系统微分方程","suggested_end_slide_not_gold":13,"suggested_start_slide_not_gold":6},{"candidate_chapter_id":"rchreview_d7a77fd7b32c4b8b5636aef2","course_id":"CTRL202","final_chapter_id":null,"final_chapter_path":null,"final_end_slide":null,"final_start_slide":null,"human_review":{"review_note":null,"reviewed_by":null,"selected":null,"status":"pending"},"source_chapter_label":"2.2 传递函数","suggested_end_slide_not_gold":26,"suggested_start_slide_not_gold":14},{"candidate_chapter_id":"rchreview_fbc61350f194915780ed56a4","course_id":"CTRL202","final_chapter_id":null,"final_chapter_path":null,"final_end_slide":null,"final_start_slide":null,"human_review":{"review_note":null,"reviewed_by":null,"selected":null,"status":"pending"},"source_chapter_label":"2.2 典型环节","suggested_end_slide_not_gold":38,"suggested_start_slide_not_gold":27},{"candidate_chapter_id":"rchreview_6b5758beb130fae4e60771bb","course_id":"CTRL202","final_chapter_id":null,"final_chapter_path":null,"final_end_slide":null,"final_start_slide":null,"human_review":{"review_note":null,"reviewed_by":null,"selected":null,"status":"pending"},"source_chapter_label":"2.3 方框图","suggested_end_slide_not_gold":48,"suggested_start_slide_not_gold":39},{"candidate_chapter_id":"rchreview_06270e5a8b39c61ed78a25a5","course_id":"CTRL202","final_chapter_id":null,"final_chapter_path":null,"final_end_slide":null,"final_start_slide":null,"human_review":{"review_note":null,"reviewed_by":null,"selected":null,"status":"pending"},"source_chapter_label":"2.3 方框图等效变换","suggested_end_slide_not_gold":83,"suggested_start_slide_not_gold":49},{"candidate_chapter_id":"rchreview_bebcad5ef77307b30081c296","course_id":"CTRL202","final_chapter_id":null,"final_chapter_path":null,"final_end_slide":null,"final_start_slide":null,"human_review":{"review_note":null,"reviewed_by":null,"selected":null,"status":"pending"},"source_chapter_label":"2.4 信号流图","suggested_end_slide_not_gold":97,"suggested_start_slide_not_gold":84},{"candidate_chapter_id":"rchreview_3bb103fbdb30eacf6f62eae1","course_id":"EE101","final_chapter_id":null,"final_chapter_path":null,"final_end_slide":null,"final_start_slide":null,"human_review":{"review_note":null,"reviewed_by":null,"selected":null,"status":"pending"},"source_chapter_label":"1.1 电路的作用与组成","suggested_end_slide_not_gold":9,"suggested_start_slide_not_gold":1},{"candidate_chapter_id":"rchreview_b9a20aa2458293915df84b83","course_id":"EE101","final_chapter_id":null,"final_chapter_path":null,"final_end_slide":null,"final_start_slide":null,"human_review":{"review_note":null,"reviewed_by":null,"selected":null,"status":"pending"},"source_chapter_label":"1.2 电路模型","suggested_end_slide_not_gold":11,"suggested_start_slide_not_gold":10},{"candidate_chapter_id":"rchreview_8304d5481fedf89f4c509537","course_id":"EE101","final_chapter_id":null,"final_chapter_path":null,"final_end_slide":null,"final_start_slide":null,"human_review":{"review_note":null,"reviewed_by":null,"selected":null,"status":"pending"},"source_chapter_label":"1.3 电压和电流的参考方向","suggested_end_slide_not_gold":15,"suggested_start_slide_not_gold":12},{"candidate_chapter_id":"rchreview_88311689ce9a863d5fcaf5e9","course_id":"EE101","final_chapter_id":null,"final_chapter_path":null,"final_end_slide":null,"final_start_slide":null,"human_review":{"review_note":null,"reviewed_by":null,"selected":null,"status":"pending"},"source_chapter_label":"1.3-1.4 欧姆定律","suggested_end_slide_not_gold":17,"suggested_start_slide_not_gold":16},{"candidate_chapter_id":"rchreview_13282545425b690882acab58","course_id":"EE101","final_chapter_id":null,"final_chapter_path":null,"final_end_slide":null,"final_start_slide":null,"human_review":{"review_note":null,"reviewed_by":null,"selected":null,"status":"pending"},"source_chapter_label":"1.4.1 无源元件","suggested_end_slide_not_gold":24,"suggested_start_slide_not_gold":18},{"candidate_chapter_id":"rchreview_fa27e226c3d88fa39d517670","course_id":"EE101","final_chapter_id":null,"final_chapter_path":null,"final_end_slide":null,"final_start_slide":null,"human_review":{"review_note":null,"reviewed_by":null,"selected":null,"status":"pending"},"source_chapter_label":"1.5.1 电源有载工作","suggested_end_slide_not_gold":29,"suggested_start_slide_not_gold":25},{"candidate_chapter_id":"rchreview_d89591242c3066ecf269a034","course_id":"EE101","final_chapter_id":null,"final_chapter_path":null,"final_end_slide":null,"final_start_slide":null,"human_review":{"review_note":null,"reviewed_by":null,"selected":null,"status":"pending"},"source_chapter_label":"1.5.2-1.5.3 开路与短路","suggested_end_slide_not_gold":32,"suggested_start_slide_not_gold":30},{"candidate_chapter_id":"rchreview_e0716d96d20dd5f2fbd61ff9","course_id":"EE101","final_chapter_id":null,"final_chapter_path":null,"final_end_slide":null,"final_start_slide":null,"human_review":{"review_note":null,"reviewed_by":null,"selected":null,"status":"pending"},"source_chapter_label":"1.6 基尔霍夫定律","suggested_end_slide_not_gold":35,"suggested_start_slide_not_gold":33},{"candidate_chapter_id":"rchreview_ae65ec9dc5af28a48360a1b5","course_id":"EE101","final_chapter_id":null,"final_chapter_path":null,"final_end_slide":null,"final_start_slide":null,"human_review":{"review_note":null,"reviewed_by":null,"selected":null,"status":"pending"},"source_chapter_label":"1.6.1 基尔霍夫电流定律","suggested_end_slide_not_gold":38,"suggested_start_slide_not_gold":36},{"candidate_chapter_id":"rchreview_45214b0cde63b18b8b1b4373","course_id":"EE101","final_chapter_id":null,"final_chapter_path":null,"final_end_slide":null,"final_start_slide":null,"human_review":{"review_note":null,"reviewed_by":null,"selected":null,"status":"pending"},"source_chapter_label":"1.6.2 基尔霍夫电压定律","suggested_end_slide_not_gold":42,"suggested_start_slide_not_gold":39},{"candidate_chapter_id":"rchreview_c24289aae10993f7a2ec054b","course_id":"EE101","final_chapter_id":null,"final_chapter_path":null,"final_end_slide":null,"final_start_slide":null,"human_review":{"review_note":null,"reviewed_by":null,"selected":null,"status":"pending"},"source_chapter_label":"1.6-1.7 综合例题","suggested_end_slide_not_gold":52,"suggested_start_slide_not_gold":43},{"candidate_chapter_id":"rchreview_78cf07f85b797b0bf9a3eca6","course_id":"EE207","final_chapter_id":null,"final_chapter_path":null,"final_end_slide":null,"final_start_slide":null,"human_review":{"review_note":null,"reviewed_by":null,"selected":null,"status":"pending"},"source_chapter_label":"7.0 概述","suggested_end_slide_not_gold":4,"suggested_start_slide_not_gold":1},{"candidate_chapter_id":"rchreview_3b20e2e3998b7a9fc0110407","course_id":"EE207","final_chapter_id":null,"final_chapter_path":null,"final_end_slide":null,"final_start_slide":null,"human_review":{"review_note":null,"reviewed_by":null,"selected":null,"status":"pending"},"source_chapter_label":"7.1 三相异步电动机的构造","suggested_end_slide_not_gold":12,"suggested_start_slide_not_gold":5},{"candidate_chapter_id":"rchreview_6b3064dcd8a6ee5a879134db","course_id":"EE207","final_chapter_id":null,"final_chapter_path":null,"final_end_slide":null,"final_start_slide":null,"human_review":{"review_note":null,"reviewed_by":null,"selected":null,"status":"pending"},"source_chapter_label":"7.2 三相异步电动机的转动原理","suggested_end_slide_not_gold":13,"suggested_start_slide_not_gold":13},{"candidate_chapter_id":"rchreview_407feb4456fe4135d4db62ff","course_id":"EE207","final_chapter_id":null,"final_chapter_path":null,"final_end_slide":null,"final_start_slide":null,"human_review":{"review_note":null,"reviewed_by":null,"selected":null,"status":"pending"},"source_chapter_label":"7.2.1 旋转磁场","suggested_end_slide_not_gold":24,"suggested_start_slide_not_gold":14},{"candidate_chapter_id":"rchreview_2b6bcd5c73703295a0a7d651","course_id":"EE207","final_chapter_id":null,"final_chapter_path":null,"final_end_slide":null,"final_start_slide":null,"human_review":{"review_note":null,"reviewed_by":null,"selected":null,"status":"pending"},"source_chapter_label":"7.2.2 电动机转动原理","suggested_end_slide_not_gold":25,"suggested_start_slide_not_gold":25},{"candidate_chapter_id":"rchreview_ff96c9ac356878511f5f5a6d","course_id":"EE207","final_chapter_id":null,"final_chapter_path":null,"final_end_slide":null,"final_start_slide":null,"human_review":{"review_note":null,"reviewed_by":null,"selected":null,"status":"pending"},"source_chapter_label":"7.2.3 转差率","suggested_end_slide_not_gold":27,"suggested_start_slide_not_gold":26},{"candidate_chapter_id":"rchreview_7f3549e7cb12ca0e221b8208","course_id":"EE207","final_chapter_id":null,"final_chapter_path":null,"final_end_slide":null,"final_start_slide":null,"human_review":{"review_note":null,"reviewed_by":null,"selected":null,"status":"pending"},"source_chapter_label":"7.4 转矩与机械特性","suggested_end_slide_not_gold":34,"suggested_start_slide_not_gold":28},{"candidate_chapter_id":"rchreview_41cff67c14ba35e95f0aeede","course_id":"EE207","final_chapter_id":null,"final_chapter_path":null,"final_end_slide":null,"final_start_slide":null,"human_review":{"review_note":null,"reviewed_by":null,"selected":null,"status":"pending"},"source_chapter_label":"7.5 三相异步电动机的起动","suggested_end_slide_not_gold":36,"suggested_start_slide_not_gold":35},{"candidate_chapter_id":"rchreview_2d23f6b3984660550e8dd536","course_id":"EE207","final_chapter_id":null,"final_chapter_